{
  "schema_version": "asw.signal.v1",
  "signal_id": "sig_save_1",
  "derived_from": [
    "evt_save_1"
  ],
  "application_id": "app.visual-studio",
  "category": "files",
  "kind": "file.saved",
  "status": "current",
  "summary": "main.cs saved",
  "subject": {
    "kind": "path",
    "value": {
      "path": "C:\\src\\project\\main.cs"
    }
  },
  "source_reliability": "authoritative",
  "created_at": "2026-08-01T12:11:00-04:00",
  "frontier": {
    "schema_version": "asw.frontier.v1",
    "journal_sequence": 9188,
    "runtime_epoch": "uuid-runtime-1",
    "source_frontiers": {
      "fs:workspace": {
        "source_epoch": "uuid-fs-3",
        "source_sequence": 42,
        "source_cursor": null,
        "snapshot_digest": "sha256:abc123",
        "reconciliation_id": "recon-3"
      }
    },
    "reducer_policy_version": "asw.reducer.v1"
  }
}
